"id_consecutivo","descripcion1","descripcion2","descripcion3","descripcion4","descripcion5","descripcion6","descripcion7","descripcion8","descripcion9","descripcion10","cantidad1","cantidad2","cantidad3","cantidad4","cantidad5","cantidad6","cantidad7","cantidad8","cantidad9","cantidad10","importe1","importe2","importe3","importe4","importe5","importe6","importe7","importe8","importe9","importe10","nombre","codigo","c_identidad","fecha","importe_total","cliente","um1","um2","um3","um4","um5","um6","um7","um8","um9","um10"
"1","Impresión de modelos varios","Impresión de credenciales para el concierto de Charly y Hohayo",,,,,,,,,"1667","100",,,,,,,,,"6.00","25.00",,,,,,,,,,,,,"12502.0","Emp Comercializadora de la Música",NULL,NULL,NULL,NULL,NULL,NULL,NULL,NULL,NULL,NULL
"2","Impresión de modelo Acopio de leche y queso",,,,,,,,,,"5000",,,,,,,,,,"6.00",,,,,,,,,,,,,,"30000.0","Empresa de Productos Lácteos Rio Zaza",NULL,NULL,NULL,NULL,NULL,NULL,NULL,NULL,NULL,NULL
"3","Impresión de modelo Medios de Rotación","Impresión de modelo SubMAyor","Impresión de modelo Declaración Jurada","Impresión de modelo IPV",,,,,,,"1000","1000","1000","500",,,,,,,"6.00","6.00","6.00","6.00",,,,,,,,,,,"21000.0","Empresa Municipal Comercio",NULL,NULL,NULL,NULL,NULL,NULL,NULL,NULL,NULL,NULL
"4","Resma de papel 81/2 x 11 de 500 hojas","Fily amarillos",,,,,,,,,"50","100",,,,,,,,,"3000.00","50.00",,,,,,,,,,,,,"155000.0","Empresa Municipal Comercio","Resma","Unidad",,,,,,,,
"5","Impresión de 8 informes de 14 hojas cada uno para Asamblea de Balance de Cultura 2024","Impresión de 8 carátulas para informe de Balance de Cultura 2024","Encuadernado de 8 informes de Balance deCultura 2024","Impresión de 190 credenciales para Asamblea de Cultura","Impresión y plasticado de 10 credenciales para Asamblea de Cultura",,,,,,"112","8","8","190","10",,,,,,"6.00","150.00","250.00","25.00","150.00",,,,,,,,,,"10122.0","Emp Comercializadora de la Música",NULL,NULL,NULL,NULL,NULL,NULL,NULL,NULL,NULL,NULL
"6","Impresión de Modelo TF587 Orden de Vía","Impresión de modelo TF 1131 Orden de Tramo","Impresión y confección de Talonarios de Boletos Original y cipia","Impresión de Modelo Gr;afico de Movimiento Centro",,,,,,,"5000","5000","200","160",,,,,,,"6.00","6.00","300.00","150.00",,,,,,,,,,,"144000.0","EEF UEB Ferrocarriles S.S.",NULL,NULL,NULL,NULL,NULL,NULL,NULL,NULL,NULL,NULL
"7","Impresión de Reconocimiento a color en cartulina Formación Doctoral","Impresión de Contrato de Alojamiento Morro Cabaña en hojas a blanco y negro","Impresión de Reconocimiento a color en cartulina Estímulo al CUM de Zaza","Impresión de 10 copias de informe de Balance Anual del 2024 ( 94 x 10 hojas=940 hojas)","Impresión de 10 carátulas de Informe en cartulina a color ","Ecuadernado de 10 informes de Balance 2024 con canutillo plástico hasta 100 hojas o más ","Impresón de Programas a color en hojas para Balance 2024",,,,"8","90","10","940","10","10","5",,,,"300.00","7.00","300.00","7.00","300.00","1000.00","30.00",,,,,,,,"25760.0","UNISS José Martí Pérez",NULL,NULL,NULL,NULL,NULL,NULL,NULL,NULL,NULL,NULL
"8","Impresión de modelo IPV","Impresión de modelo Control de Venta de Canastilla","Impresión de Modelo Vale de Venta","Impresión de Modelo Oerde de Pago","Impresión de Modelo desglose de dinero","Impresión  de modelo Vale de entrega o devolución",,,,,"800","200","200","200","300","500",,,,,"6.00","6.00","6.00","6.00","6.00","6.00",,,,,,,,,"13200.0","UEB Paraiso Infantil",NULL,NULL,NULL,NULL,NULL,NULL,NULL,NULL,NULL,NULL
"9","Impresión de Tarjetas de Estiba",,,,,,,,,,"100",,,,,,,,,,"100.00",,,,,,,,,,,,,,"10000.0","UEB Paraiso Infantil",NULL,NULL,NULL,NULL,NULL,NULL,NULL,NULL,NULL,NULL
"10","Impresión de modelo TF 590","Impresión de modelo TF 1130","Impresión de modelo Orden de Vía","Impresión de modelo Control de Circulaciones",,,,,,,"2600","2600","2500","700",,,,,,,"6.00","6.00","6.00","6.00",,,,,,,,,,,"50400.0","EEF UEB Ferrocarriles S.S.",NULL,NULL,NULL,NULL,NULL,NULL,NULL,NULL,NULL,NULL
"11","Resma de papel 81/2 x 11 de 500 hojas","Lapiceros",,,,,,,,,"10","100",,,,,,,,,"3000.00","80.00",,,,,,,,,,,,,"38000.0","Empresa Municipal de Servicios Comunales","Resma","U",,,,,,,,
"12","Impresión de Nóminas Diciembre","Impresión de modelo Análisis Periódico","Impresión de modelo Registro de Asistencia","Impresión de modelo Contrato de Trabajo","Impresión de 4 Resoluciones ",,,,,,"326","500","500","500","266",,,,,,"6.00","6.00","6.00","6.00","6.00",,,,,,,,,,"12552.0","Empresa Municipal de Servicios Comunales",,,,,,,,,,
"13","Impresión de Tesis de Doctorado Yodanky","Impresión de Tesis de Doctorado Osmany","Impresión de Tesis de Doctorado Yander","Impresión de Tesis de Doctorado Ofelia","Encuadernado de 4 Tesis de Doctorado","Impresión de Resolución 36/2024","Impresión de Resolución 37/2024","Impresión de Resolución 160/2023",,,"176","185","118","174","4","264","258","222",,,"7.00","7.00","7.00","7.00","1000.00","7.00","7.00","7.00",,,,,,,"13779.0","UNISS José Martí Pérez",NULL,NULL,NULL,NULL,NULL,NULL,NULL,NULL,NULL,NULL
"14","Impresión de Reconocimientos en cartulina a color para Defensa Doctoral",,,,,,,,,,"23",,,,,,,,,,"300.00",,,,,,,,,,,,,,"6900.0","UNISS José Martí Pérez",NULL,NULL,NULL,NULL,NULL,NULL,NULL,NULL,NULL,NULL
"15","Impresioón de Modelo Liquidación de Efectivo","Impresión de Modelo Platos Vendidos (SCO-02)","Impresión de Modelo Productos Para Confección del Menu","Impresión de Modelo Registro de Asistencia","Impresión de Modelo Solicitud de Servicio",,,,,,"3000","3000","3000","3000","3000",,,,,,"7.00","7.00","7.00","7.00","7.00",,,,,,,,,,"105000.0","UNISS José Martí Pérez",NULL,NULL,NULL,NULL,NULL,NULL,NULL,NULL,NULL,NULL
"16","Impresión de Modelo Solicitud de Servicios","Impresión de ModeloLimpieza de Calle",,,,,,,,,"500","500",,,,,,,,,"6.00","6.00",,,,,,,,,,,,,"6000.0","Empresa Municipal de Servicios Comunales",NULL,NULL,NULL,NULL,NULL,NULL,NULL,NULL,NULL,NULL
"17","Impresión de modelo Aporte a la ONAT",,,,,,,,,,"100",,,,,,,,,,"12.00",,,,,,,,,,,,,,"1200.0","UEB Paraiso Infantil",NULL,NULL,NULL,NULL,NULL,NULL,NULL,NULL,NULL,NULL
"18","Impresión de hojas timbradas ",,,,,,,,,,"25000",,,,,,,,,,"6.00",,,,,,,,,,,,,,"150000.0","Empresa Municipal Comercio","Hojas",,,,,,,,,
"19","Impresión de modelo TF441","Impresión de modelo Orden de Tren","Impresión de modelo OPT Precausión de Tramo","Impresión de modelo TF 591 Registro de Orden de Vía",,,,,,,"100","1000","1000","100",,,,,,,"6.00","6.00","6.00","600.00",,,,,,,,,,,"72600.0","EEF UEB Ferrocarriles S.S.",,,,,,,,,,
"20","Cuño Printer R40 ","Cuño Stamp Plus30",,,,,,,,,"3","1",,,,,,,,,"5000.00","4500.00",,,,,,,,,,,,,"19500.0","EEF UEB Ferrocarriles S.S.","U","U",,,,,,,,
"21","Impresión de modelo TF-587 Orden de Via","Impresión de modelo TF 1131 Orden de Precausión de Tramo","Impresión de Modelo  TF 591 Registro de Orden de Via","Impresión de Gráfico de Movimiento Centro 3 mesas",,,,,,,"5000","5000","100","60",,,,,,,"6.00","6.00","600.00","900.00",,,,,,,,,,,"174000.0","EEF UEB Ferrocarriles S.S.",NULL,NULL,NULL,NULL,NULL,NULL,NULL,NULL,NULL,NULL
"22","Impresión de Modelos Varios",,,,,,,,,,"1034",,,,,,,,,,"6.00",,,,,,,,,,,,,,"6204.0","Emp Comercializadora de la Música",NULL,NULL,NULL,NULL,NULL,NULL,NULL,NULL,NULL,NULL
"23","Impresión de Reconocimientos a Color en cartulina para Evaluadores Externos","Impresión de foto formato 5 x 7 para Evaluadores Externos",,,,,,,,,"16","18",,,,,,,,,"300.00","600.00",,,,,,,,,,,,,"15600.0","UNISS José Martí Pérez",NULL,NULL,NULL,NULL,NULL,NULL,NULL,NULL,NULL,NULL
"24","Impresión de Tiket para comedor en hojas a Blanco y Negro",,,,,,,,,,"2000",,,,,,,,,,"7.00",,,,,,,,,,,,,,"14000.0","UNISS José Martí Pérez",NULL,NULL,NULL,NULL,NULL,NULL,NULL,NULL,NULL,NULL
"25","Impresión de Nóminas mes de Enero ","Impresión de Vale de entrega o devolución","Impresión de modelo Anexo al contrato","Impresión de hojas de Rutas","Impresión de solicitud de Almacen","Impresión de Hojas de firmas","Impresón de Resoluciones",,,,"432","2500","500","500","500","500","622",,,,"6.00","6.00","6.00","6.00","6.00","6.00","6.00",,,,,,,,"33324.0","Empresa Municipal de Servicios Comunales",NULL,NULL,NULL,NULL,NULL,NULL,NULL,NULL,NULL,NULL
"26","Resma de Papel 81/2 x 11 de 500 hojas","Cuño Printer R40 ",,,,,,,,,"20","4",,,,,,,,,"3000.00","5120.00",,,,,,,,,,,,,"80480.0","Empresa Municipal de Servicios Comunales","Resma","U",,,,,,,,
"27","Resma de papel 81/2 x 11 de 500 hojas","Lapiceros",,,,,,,,,"10","50",,,,,,,,,"3000.00","80.00",,,,,,,,,,,,,"34000.0","UEB Sur Comercio","Resma","U",,,,,,,,
"28","Impresión de Reconocimientos en Cartulina a color para Acreditación de la Maestria Pedagojia y Psicología","Impresión de foto formato 5 x 7 para Acreditadores",,,,,,,,,"4","5",,,,,,,,,"300.00","600.00",,,,,,,,,,,,,"4200.0","UNISS José Martí Pérez",NULL,NULL,NULL,NULL,NULL,NULL,NULL,NULL,NULL,NULL
"29","Impresión de Reconocimientos a color en cartulina Plasticados para mejores trabajadores y UEB","Impresión de Reconocimientos en papel fotográfico enmarcados 8 x 12",,,,,,,,,"22","2",,,,,,,,,"1300.00","12000.00",,,,,,,,,,,,,"52600.0","Empresa Municipal Comercio",NULL,NULL,NULL,NULL,NULL,NULL,NULL,NULL,NULL,NULL
"30","Impresón de Reconocimientos a color en cartulina para Formación de Posgrado","Impresión de reconocimeintos en papel a color para Formaión de Posgrados",,,,,,,,,"8","30",,,,,,,,,"300.00","30.00",,,,,,,,,,,,,"3300.0","UNISS José Martí Pérez",NULL,NULL,NULL,NULL,NULL,NULL,NULL,NULL,NULL,NULL
"31","Impresión de Contratos de Prestación de Servicios","Impresión de modelo Limpieza de Calle","Impresión de Hojas de Firmas","Impresión de hoja multiple",,,,,,,"550","500","1000","1000",,,,,,,"6.00","6.00","6.00","6.00",,,,,,,,,,,"18300.0","Empresa Municipal de Servicios Comunales",NULL,NULL,NULL,NULL,NULL,NULL,NULL,NULL,NULL,NULL
"32","Impresión de Reconocimientos a color en cartulina para Posgrado",,,,,,,,,,"19",,,,,,,,,,"300.00",,,,,,,,,,,,,,"5700.0","UNISS José Martí Pérez",NULL,NULL,NULL,NULL,NULL,NULL,NULL,NULL,NULL,NULL
"33","Resma de papel 81/2 x 11 de 500 hojas","Lapiceros ",,,,,,,,,"20","50",,,,,,,,,"3000.00","80.00",,,,,,,,,,,,,"64000.0","Empresa Municipal de Servicios Comunales","Resma","U",,,,,,,,
"34","Impresión de nóminas y pago mes de febrero","Impresión de Rsoluciones Varias","Impresión de Anexo al Contrato","Impresión de Evaluación mensual de trabajadores","Impresión de hojas timbradas",,,,,,"356","1211","500","1500","11667",,,,,,"6.00","6.00","6.00","6.00","6.00",,,,,,,,,,"91404.0","Empresa Municipal de Servicios Comunales",,,,,,,,,,
"35","Impresión de Modelos VArios",,,,,,,,,,"2127",,,,,,,,,,"6.00",,,,,,,,,,,,,,"12762.0","Emp Comercializadora de la Música",NULL,NULL,NULL,NULL,NULL,NULL,NULL,NULL,NULL,NULL
"36","Confección de Catálogos FIAGROP 2024","Confeción de llaveros",,,,,,,,,"20","25",,,,,,,,,"3105.00","400.00",,,,,,,,,,,,,"72100.0","Empresa Carnica Sancti Síritus",NULL,NULL,NULL,NULL,NULL,NULL,NULL,NULL,NULL,NULL
"37","Confección de credenciales ",,,,,,,,,,"140",,,,,,,,,,"150.00",,,,,,,,,,,,,,"21000.0","UNISS José Martí Pérez",NULL,NULL,NULL,NULL,NULL,NULL,NULL,NULL,NULL,NULL
"38","Impresión de modelo Orden de Vía","Impresión y confección de Talonarios de Boletos Original y cipia",,,,,,,,,"4500","200",,,,,,,,,"6.00","300.00",,,,,,,,,,,,,"87000.0","EEF UEB Ferrocarriles S.S.",NULL,NULL,NULL,NULL,NULL,NULL,NULL,NULL,NULL,NULL
"39","Impresión de Tiket para comedor en hojas a Blanco y Negro",,,,,,,,,,"5000",,,,,,,,,,"7.00",,,,,,,,,,,,,,"35000.0","UNISS José Martí Pérez",NULL,NULL,NULL,NULL,NULL,NULL,NULL,NULL,NULL,NULL
"40","Impresió de modelo Limpieza de calle","Impresión de Contratos de PrestacióndeServicio","Impresión de Inventarios","Impresión de Registro de Asistencia","Impresión de modelo Recogida de Desechos Solidos","Impresión de modelo Contrato de Trabajo","Impresión de modelo Notificación de Servicios","Impresión de modelo Informe de Recepción",,,"500","300","277","500","100","1000","200","500",,,"6.00","6.00","6.00","6.00","6.00","6.00","6.00","6.00",,,,,,,"20262.0","Empresa Municipal de Servicios Comunales",NULL,NULL,NULL,NULL,NULL,NULL,NULL,NULL,NULL,NULL
"41","Resma de papel 81/2 x 11 de 500 hojas",,,,,,,,,,"20",,,,,,,,,,"3000.00",,,,,,,,,,,,,,"60000.0","Empresa Municipal de Servicios Comunales","Resma",,,,,,,,,
"42","Impresión de modelo IPVC",,,,,,,,,,"1000",,,,,,,,,,"6.00",,,,,,,,,,,,,,"6000.0","UEB Paraiso Infantil",NULL,NULL,NULL,NULL,NULL,NULL,NULL,NULL,NULL,NULL
"43","Impresión de Reconocimiento a Color en Cartulina","Impresión de Reconocimiento a color en Hojas",,,,,,,,,"18","120",,,,,,,,,"300.00","30.00",,,,,,,,,,,,,"9000.0","UNISS José Martí Pérez",NULL,NULL,NULL,NULL,NULL,NULL,NULL,NULL,NULL,NULL
"44","Impresión de modelos Varios",,,,,,,,,,"3348",,,,,,,,,,"6.00",,,,,,,,,,,,,,"20088.0","Emp Comercializadora de la Música",NULL,NULL,NULL,NULL,NULL,NULL,NULL,NULL,NULL,NULL
"45","Resma de papel 81/2 x 11 de 500 hojas",,,,,,,,,,"10",,,,,,,,,,"3000.00",,,,,,,,,,,,,,"30000.0","Dirección Municipal de Cultura","Resma",,,,,,,,,
"46","Imppresión de modelo Orden de Vía","Impresión de Modelo Orden de Precaución de Tramo","Impresión de Modelo Registro de Orden de Vía 591","Impresión y confección de Talonarios de Boletos Original y copia",,,,,,,"5000","5000","3000","200",,,,,,,"6.00","6.00","12.00","300.00",,,,,,,,,,,"156000.0","EEF UEB Ferrocarriles S.S.",NULL,NULL,NULL,NULL,NULL,NULL,NULL,NULL,NULL,NULL
"47","Impresión de Reconocimiento a color en cartulinaa color para Evaluación Externa de Maestria","Impresión de fotos formato 5x7 ",,,,,,,,,"4","5",,,,,,,,,"300.00","600.00",,,,,,,,,,,,,"4200.0","UNISS José Martí Pérez",NULL,NULL,NULL,NULL,NULL,NULL,NULL,NULL,NULL,NULL
"48","Resma de papel 81/2 x 11 de 500 hojas","Lapiceros",,,,,,,,,"30","50",,,,,,,,,"3000.00","80.00",,,,,,,,,,,,,"94000.0","Empresa Municipal de Servicios Comunales","Resma","U",,,,,,,,
"49","Impresión de hojas timbradas",,,,,,,,,,"25000",,,,,,,,,,"6.00",,,,,,,,,,,,,,"150000.0","Empresa Municipal Comercio",NULL,NULL,NULL,NULL,NULL,NULL,NULL,NULL,NULL,NULL
"50","Impresión de Gráfico Movimiento Centro M1","Impresión de Gráfico Movimiento Centro M2","Impresión de Gráfico Movimiento Centro M3",,,,,,,,"50","50","50",,,,,,,,"1000.00","1000.00","1000.00",,,,,,,,,,,,"150000.0","EEF UEB Ferrocarriles S.S.",NULL,NULL,NULL,NULL,NULL,NULL,NULL,NULL,NULL,NULL
"51","Impresión de medios Básicos ( Dos copias)","Impresión de documentos para entrega del cargo","Impresión de nóminas mes de marzo","Impresón de modelo Limpieza de calle","Imrepresión de modelo Recogida de desechos sólidos","Impresión de Registro de Asistencia","Impresión de notificación de vacaciones",,,,"231","132","354","500","500","500","800",,,,"6.00","6.00","6.00","6.00","6.00","6.00","6.00",,,,,,,,"18102.0","Empresa Municipal de Servicios Comunales",,,,,,,,,,
"52","Impresión deC ontratos de Prestación de Servicios (159 x 7 hojas cada uno)","Impresión de Anexos al Contrato ( !59 x 6 hojas)",,,,,,,,,"1113","954",,,,,,,,,"6.00","6.00",,,,,,,,,,,,,"12402.0","Emp Comercializadora de la Música",NULL,NULL,NULL,NULL,NULL,NULL,NULL,NULL,NULL,NULL
"53","Resma de papel 81/2 x 11 de 500 hojas ","Lapiceros",,,,,,,,,"30","100",,,,,,,,,"3000.00","80.00",,,,,,,,,,,,,"98000.0","Empresa Municipal de Servicios Comunales","Resma","U",,,,,,,,
"54","Impresión de Modelo Anexo al Contrato de Servicios Artísticos","Impresión de modelo M-1",,,,,,,,,"1000","1000",,,,,,,,,"6.00","6.00",,,,,,,,,,,,,"12000.0","Emp Comercializadora de la Música",NULL,NULL,NULL,NULL,NULL,NULL,NULL,NULL,NULL,NULL
"55","Impresión de modelos Varios",,,,,,,,,,"977",,,,,,,,,,"6.00",,,,,,,,,,,,,,"5862.0","Emp Comercializadora de la Música",NULL,NULL,NULL,NULL,NULL,NULL,NULL,NULL,NULL,NULL
"56","Impresion  de Nóminas mes de Abril","Impresión de modelo de Servicio de limpieza de Zonas, Calles y áreas recreativas","Impresión de modelo Reporte de producción o trabajo Realizado","Impresión de hojas Timbradas",,,,,,,"402","1000","200","5000",,,,,,,"6.00","6.00","6.00","6.00",,,,,,,,,,,"39612.0","Empresa Municipal de Servicios Comunales",NULL,NULL,NULL,NULL,NULL,NULL,NULL,NULL,NULL,NULL
"57","Impresión de Reconocimiento en cartulina a color para Tesis Doctorales ","Impresión de Tesis Defensa Marian Belkis Nápoles en b/n en hoja carta ","Impresión de Tesis defensa Neisy Caridad Rodríguez a B/N en hoja carta  ","Encuadernado de dos Tesis ",,,,,,,"16","299","175","2",,,,,,,"300.00","7.00","7.00","1000.00",,,,,,,,,,,"10118.0","UNISS José Martí Pérez",NULL,NULL,NULL,NULL,NULL,NULL,NULL,NULL,NULL,NULL
"58","Impresión y confección de Talonarios de Boletos Original y copia","Impresión de modelo Orden de Vía",,,,,,,,,"200","1000",,,,,,,,,"300.00","6.00",,,,,,,,,,,,,"66000.0","EEF UEB Ferrocarriles S.S.",NULL,NULL,NULL,NULL,NULL,NULL,NULL,NULL,NULL,NULL
"59","Impresión de hojas timbradas ","Impresión de modelo hoja de ruta",,,,,,,,,"10000","700",,,,,,,,,"6.00","6.00",,,,,,,,,,,,,"64200.0","Empresa Municipal de Servicios Comunales",NULL,NULL,NULL,NULL,NULL,NULL,NULL,NULL,NULL,NULL
"60","Impresión de plegables Convocatoria Universidad 2026","Impresión de sueltos a color en hojas ( 8th International Scientific Conference)",,,,,,,,,"20","130",,,,,,,,,"120.00","30.00",,,,,,,,,,,,,"6300.0","UNISS José Martí Pérez",NULL,NULL,NULL,NULL,NULL,NULL,NULL,NULL,NULL,NULL
"61","Cajitas de presillas de Patas","Plumas de gala","Cajitas de presillas Clip pequeña","Cajita de presilla Clip grande",,,,,,,"20","24","12","1",,,,,,,"300.00","300.00","400.00","800.00",,,,,,,,,,,"18800.0","Empresa Municipal de Servicios Comunales","U","U","U","U",,,,,,
"62","Plumas de Gala","Cajita se presillas clip","Cajitas de Presillas de patas",,,,,,,,"24","9","20",,,,,,,,"300.00","400.00","300.00",,,,,,,,,,,,"16800.0","Empresa Municipal Comercio","U","U","U",,,,,,,
"63","Impresión de Gráfico Movimiento Centro M1","Impresión de Gráfico Movimiento Centro M2","Impresión de Gráfico Movimiento Centro M3","Impresión de Modelo Registro de Orden de Vía 591 a doble cara",,,,,,,"50","50","50","1000",,,,,,,"1000.00","1000.00","1000.00","24.00",,,,,,,,,,,"174000.0","EEF UEB Ferrocarriles S.S.",NULL,NULL,NULL,NULL,NULL,NULL,NULL,NULL,NULL,NULL
"64","Cajitas de Presillas de patas",,,,,,,,,,"19",,,,,,,,,,"300.00",,,,,,,,,,,,,,"5700.0","Empresa Carnica Sancti Síritus","U",,,,,,,,,
"65","Impresión modelo de hojas de firmas",,,,,,,,,,"500",,,,,,,,,,"6.00",,,,,,,,,,,,,,"3000.0","Dirección Municipal de Cultura",NULL,NULL,NULL,NULL,NULL,NULL,NULL,NULL,NULL,NULL
"66","Impresión de hojas timbradas 81/2 x 11",,,,,,,,,,"10000",,,,,,,,,,"6.00",,,,,,,,,,,,,,"60000.0","Empresa Municipal Comercio",NULL,NULL,NULL,NULL,NULL,NULL,NULL,NULL,NULL,NULL
"67","Impresión de Foto oficial formato 5 x 7 para  la Evaluación  Carrera Agroindustrial",,,,,,,,,,"6",,,,,,,,,,"600.00",,,,,,,,,,,,,,"3600.0","UNISS José Martí Pérez",NULL,NULL,NULL,NULL,NULL,NULL,NULL,NULL,NULL,NULL
"68","Impresión de nómonas del mes de mayo","Impresión de hojas de firmas","Impresión de hojas timbradas",,,,,,,,"429","1000","10000",,,,,,,,"6.00","6.00","6.00",,,,,,,,,,,,"68574.0","Empresa Municipal de Servicios Comunales",NULL,NULL,NULL,NULL,NULL,NULL,NULL,NULL,NULL,NULL
"69","Impresión de modelos Varios",,,,,,,,,,"1173",,,,,,,,,,"6.00",,,,,,,,,,,,,,"7038.0","Emp Comercializadora de la Música",NULL,NULL,NULL,NULL,NULL,NULL,NULL,NULL,NULL,NULL
"70","Impresión de Reconocimientos en cartulina a color para Evaluación Externa de Carrera Universitarias ","Impresión de Fotos en Formatos 5 x 7 ",,,,,,,,,"10","12",,,,,,,,,"300.00","600.00",,,,,,,,,,,,,"10200.0","UNISS José Martí Pérez",NULL,NULL,NULL,NULL,NULL,NULL,NULL,NULL,NULL,NULL
"71","Impresión de modelo Análisis periódicode asistencia",,,,,,,,,,"1100",,,,,,,,,,"6.00",,,,,,,,,,,,,,"6600.0","UEB Paraiso Infantil",NULL,NULL,NULL,NULL,NULL,NULL,NULL,NULL,NULL,NULL
"72","Lapiceros",,,,,,,,,,"50",,,,,,,,,,"80.00",,,,,,,,,,,,,,"4000.0","EEF UEB Ferrocarriles S.S.","U",,,,,,,,,
"73","Impresión de hojas timbradas",,,,,,,,,,"2500",,,,,,,,,,"6.00",,,,,,,,,,,,,,"15000.0","EMI Francisco Aguiar Rodríguez",,,,,,,,,,
"74","Impresión de Resoluciones y Decretos","Impresión de Nóminas ","Impresión de modelo Servicios de Áreas verdes ","Impresión de modelo Cumplimiento de Indicadores","Impresión de hojas timbradas",,,,,,"271","287","200","2000","20000",,,,,,"6.00","6.00","6.00","6.00","6.00",,,,,,,,,,"136548.0","Empresa Municipal de Servicios Comunales",NULL,NULL,NULL,NULL,NULL,NULL,NULL,NULL,NULL,NULL
"75","Impresión de Gráfico Movimiento Centro M1","Impresión de Gráfico Movimiento Centro M2","Impresión de Gráfico Movimiento Centro M3",,,,,,,,"50","50","50",,,,,,,,"1000.00","1000.00","1000.00",,,,,,,,,,,,"150000.0","EEF UEB Ferrocarriles S.S.",NULL,NULL,NULL,NULL,NULL,NULL,NULL,NULL,NULL,NULL
"76","Impresión de hojas timbradas",,,,,,,,,,"2834",,,,,,,,,,"6.00",,,,,,,,,,,,,,"17004.0","EEF UEB Ferrocarriles S.S.",NULL,NULL,NULL,NULL,NULL,NULL,NULL,NULL,NULL,NULL
"77","Impresión  de Contratos de Prestación de Servicios","Impresión de hojas timbrdas",,,,,,,,,"1500","5000",,,,,,,,,"6.00","6.00",,,,,,,,,,,,,"39000.0","Empresa Municipal de Servicios Comunales",NULL,NULL,NULL,NULL,NULL,NULL,NULL,NULL,NULL,NULL
"78","Impresión de hojas timbradas",,,,,,,,,,"10000",,,,,,,,,,"6.00",,,,,,,,,,,,,,"60000.0","Empresa Municipal de Servicios Comunales",NULL,NULL,NULL,NULL,NULL,NULL,NULL,NULL,NULL,NULL
"79","Impresión de hojas timbradas",,,,,,,,,,"6000",,,,,,,,,,"6.00",,,,,,,,,,,,,,"36000.0","Dirección Municipal de Cultura",NULL,NULL,NULL,NULL,NULL,NULL,NULL,NULL,NULL,NULL
"80","Impresión de Modelos Varios",,,,,,,,,,"1924",,,,,,,,,,"6.00",,,,,,,,,,,,,,"11544.0","Emp Comercializadora de la Música",NULL,NULL,NULL,NULL,NULL,NULL,NULL,NULL,NULL,NULL
"81","Impresión de Modelo Hojas de Rutas","Impresión de Modelo Hojas de Firmas","Impresión de Modelo Hoja Multiple","Impresión de Modelo Limpieza de Calle","Impresión de Resoluciones Varias",,,,,,"2500","2000","1000","1000","2522",,,,,,"6.00","6.00","6.00","6.00","6.00",,,,,,,,,,"54132.0","Empresa Municipal de Servicios Comunales",NULL,NULL,NULL,NULL,NULL,NULL,NULL,NULL,NULL,NULL
"82","Impresión de Modelo Orden de Vía","Impresión y confección de Talonarios de Boletos Original y copia",,,,,,,,,"5000","200",,,,,,,,,"6.00","300.00",,,,,,,,,,,,,"90000.0","EEF UEB Ferrocarriles S.S.",NULL,NULL,NULL,NULL,NULL,NULL,NULL,NULL,NULL,NULL
"83","Impresión de reconocimiento a color en cartulina para graduación del curso 2024-2025","Impresión de fotos 12 x 18 para reconocimientos de mejores graduados  del curso 2024-2025",,,,,,,,,"75","23",,,,,,,,,"300.00","6000.00",,,,,,,,,,,,,"160500.0","UNISS José Martí Pérez",NULL,NULL,NULL,NULL,NULL,NULL,NULL,NULL,NULL,NULL
"84","Lapiceros ","Plumas MaxGlider","Cajas de presilas No 26/6",,,,,,,,"36","24","5",,,,,,,,"80.00","150.00","500.00",,,,,,,,,,,,"8980.0","Empresa Carnica Sancti Síritus","U","U","U",,,,,,,
"85","Impresión de hojas timbradas",,,,,,,,,,"25000",,,,,,,,,,"6.00",,,,,,,,,,,,,,"150000.0","Empresa Municipal Comercio",NULL,NULL,NULL,NULL,NULL,NULL,NULL,NULL,NULL,NULL
"86","Impresión de hojas timbradas",,,,,,,,,,"1500",,,,,,,,,,"6.00",,,,,,,,,,,,,,"9000.0","EEF UEB Ferrocarriles S.S.",NULL,NULL,NULL,NULL,NULL,NULL,NULL,NULL,NULL,NULL
"87","Impresión de foto formato 12 x18 para la despedida del profesor Dr.C Rey Gosa",,,,,,,,,,"1",,,,,,,,,,"6000.00",,,,,,,,,,,,,,"6000.0","UNISS José Martí Pérez",NULL,NULL,NULL,NULL,NULL,NULL,NULL,NULL,NULL,NULL
"88","Impresión de Reconocimiento a color en cartulina para Conferencia Científico Metodológica",,,,,,,,,,"38",,,,,,,,,,"300.00",,,,,,,,,,,,,,"11400.0","UNISS José Martí Pérez",NULL,NULL,NULL,NULL,NULL,NULL,NULL,NULL,NULL,NULL
"89","Impresión de Modelo M-1","Impresión de Modelo M-2","Impresión de Modelo SNC 225","Impresión de Modelo CNC 125",,,,,,,"1000","1000","200","300",,,,,,,"6.00","6.00","6.00","6.00",,,,,,,,,,,"15000.0","Emp Comercializadora de la Música",NULL,NULL,NULL,NULL,NULL,NULL,NULL,NULL,NULL,NULL
"90","Impresión de Contrato de Persona Natural Casa de la Música ( 40 x 7 x 3 )","Impresión demodelo  Registro de Contrato Representación Artística ","Impresión de Modelo Solicitud de Talento Artístico","Impresión de Contrato de Servicio Artístico ( 40 cantidad x 3 juegos x 13 hojas )","Impresión de Anexo Al Contrato de Servicio Artístico ","Impresión de Contrato de Representación Artística ( 13 hojas x 30 cantidad x 3 juegos )",,,,,"840","30","300","1560","200","1170",,,,,"6.00","6.00","6.00","6.00","6.00","6.00",,,,,,,,,"24600.0","Emp Comercializadora de la Música",NULL,NULL,NULL,NULL,NULL,NULL,NULL,NULL,NULL,NULL
"91","Impresión de foto formato 12 x 18 para Reconocimiento al profesor  Reygoza",,,,,,,,,,"1",,,,,,,,,,"6000.00",,,,,,,,,,,,,,"6000.0","UNISS José Martí Pérez",NULL,NULL,NULL,NULL,NULL,NULL,NULL,NULL,NULL,NULL
"92","Impresión de nóminas ","Impresión de modelo Servicio de limpieza de Zona","Impresión de modelo hojas de firmas","Impresión de modelo servicios de Áreas verdes","Impresión de hojas timbradas",,,,,,"413","1000","1000","1000","10000",,,,,,"6.00","6.00","6.00","6.00","6.00",,,,,,,,,,"80478.0","Empresa Municipal de Servicios Comunales",NULL,NULL,NULL,NULL,NULL,NULL,NULL,NULL,NULL,NULL
"93","Impresión de Gráfico  Movimiento Centro M1","Impresión de Gráfico  Movimiento Centro M1","Impresión de Gráfico  Movimiento Centro M1",,,,,,,,"50","50","50",,,,,,,,"1000.00","1000.00","1000.00",,,,,,,,,,,,"150000.0","EEF UEB Ferrocarriles S.S.",,,,,,,,,,
